{
  "protocol": "render-json",
  "protocolVersion": "1.0.0",
  "pageId": "task-center",
  "revision": "1",
  "root": {
    "id": "task-center-root",
    "component": "zg-list-main-layout",
    "componentVersion": "1.0.0",
    "props": {
      "schema": {
        "id": "task-center-list",
        "version": "1.0.0",
        "title": "任务中心",
        "component": "zg-common-list",
        "tab": {
          "activeTab": "all",
          "tabs": [
            { "key": "all", "label": "全部任务" },
            { "key": "mine", "label": "我负责的" }
          ]
        },
        "filters": [
          {
            "key": "title",
            "label": "任务标题",
            "component": "zg-input",
            "options": {
              "placeholder": "输入名称后回车搜索",
              "query": { "field": "title", "op": "like", "submitOnEnter": true }
            }
          },
          {
            "key": "owner",
            "label": "负责人",
            "component": "zg-selector",
            "options": {
              "list": [
                { "key": "zhou", "value": "zhou" },
                { "key": "amy", "value": "amy" }
              ],
              "multiple": true,
              "filterable": true,
              "clearable": true,
              "query": { "field": "owner", "op": "in", "submitOnChange": true }
            }
          }
        ],
        "fields": [
          { "key": "id", "name": "id", "label": "任务编号", "field": ["id"], "options": { "styles": { "width": 140 } } },
          { "key": "title", "name": "title", "label": "任务标题", "field": ["title"] },
          { "key": "owner", "name": "owner", "label": "负责人", "field": ["owner"] },
          { "key": "deadline", "name": "deadline", "label": "截止时间", "field": ["deadline"] },
          { "key": "priority", "name": "priority", "label": "优先级", "field": ["priority"] }
        ],
        "actions": [
          { "key": "refresh", "name": "刷新", "action": "RELOAD", "options": { "type": "primary", "icon": "refresh" } }
        ],
        "summary": {
          "cards": [
            { "key": "pending", "label": "待处理", "value": 1, "hint": "需要尽快跟进" },
            { "key": "running", "label": "进行中", "value": 1, "hint": "正在处理" }
          ]
        },
        "list_config": {
          "variant": "workbench",
          "itemType": "table",
          "actionColumns": [
            { "key": "view", "name": "查看", "action": "VIEW", "options": { "type": "primary" } },
            { "key": "delete", "name": "删除", "action": "DELETE", "options": { "type": "danger" } }
          ],
          "pagination": { "enabled": true, "pageSize": 10, "pageSizeOptions": [10, 20, 50] }
        }
      },
      "state": {
        "loading": false,
        "empty": false
      }
    },
    "datasource": {
      "key": "knowledge-document-query",
      "type": "db-query-list",
      "model": "ai_kb_document",
      "filter_dict": { "status": 1, "is_delete": 0 },
      "filterExpr": "status and is_delete",
      "page": 1,
      "page_size": 10,
      "ext": {
        "fields": ["id", "title", "owner", "deadline", "priority", "tag.title"],
        "relations": [
          {
            "key": "tag",
            "model": "ai_kb_document_tag",
            "type": "left",
            "on": { "id": "document_id" },
            "filter": { "status": 1, "is_delete": 0 }
          }
        ],
        "sorts": [{ "field": "id", "order": "desc" }]
      }
    },
    "layout": {
      "minHeight": "560px"
    }
  }
}
